	title	is_fake	title_processed
3785	Германия подсчитала убытки от антироссийских санкций	0	германия подсчитала убытки от антироссийских санкций
1352	Производитель мессенджера Line удвоил выручку по итогам третьего квартала	0	производитель мессенджера line удвоил выручку по итогам третьего квартала
5536	Автора единственного гола аргентинцев на ЧМ накажут	0	автора единственного гола аргентинцев на чм накажут
5233	«Есть множество цветных изображений Петра Первого, но ни одного цветного изображения Хрущёва»: Анатолий Фоменко заявил о фальсификации порядка российских правителей	1	есть множество цветных изображений петра первого но ни одного цветного изображения хрущёва анатолий фоменко заявил о фальсификации порядка российских правителей
2130	Кудрин поможет регионам-середнякам	0	кудрин поможет регионамсереднякам
982	Бывший тренер московского Динамо добился увольнения капитана Спарты	0	бывший тренер московского динамо добился увольнения капитана спарты
456	Ученые узнали о винодельческом бизнесе римских императоров	0	ученые узнали о винодельческом бизнесе римских императоров
1486	Навальный: «Я позвонил Элле Памфиловой. Она призналась»	1	навальный я позвонил элле памфиловой она призналась
1079	Лидер Foo Fighters появился на сцене в фиолетовом гипсе	0	лидер foo fighters появился на сцене в фиолетовом гипсе
1950	Совет по правам человека призвал жестоко наказать ЛГБТ-семью из публикации ВкусВилла	1	совет по правам человека призвал жестоко наказать лгбтсемью из публикации вкусвилла
4950	2022 год в России объявлен годом ненависти к врагам	1	 год в россии объявлен годом ненависти к врагам
689	Украинские пограничники задержали двух бомжей и лесника, а затем назвали это предотвращением массового прорыва нелегальных мигрантов	1	украинские пограничники задержали двух бомжей и лесника а затем назвали это предотвращением массового прорыва нелегальных мигрантов
2429	Thomson Reuters сообщил о лидерстве России по приросту золотого запаса	0	thomson reuters сообщил о лидерстве россии по приросту золотого запаса
641	Единая Россия подарила ЦИК 110 миллионов ручек для голосования	1	единая россия подарила цик  миллионов ручек для голосования
2392	Тарантино рассказал о любимом видеоформате	0	тарантино рассказал о любимом видеоформате
2825	Подготовлен законопроект о переселении москвичей в Арктику	1	подготовлен законопроект о переселении москвичей в арктику
1953	Власти решили карать за плохой прогноз о ценах на бензин	0	власти решили карать за плохой прогноз о ценах на бензин
3588	Россияне смогут повторно пройти срочную военную службу в армии Союзного государства	1	россияне смогут повторно пройти срочную военную службу в армии союзного государства
3058	В Москву запретят въезжать на автомобилях старше 15 лет	1	в москву запретят въезжать на автомобилях старше  лет
3612	В Госдуме создали комиссию по инспекции зарубежных курортов	1	в госдуме создали комиссию по инспекции зарубежных курортов
4306	Нижегородский судья санкционировал обыск на МКС по делу «открытого космоса»	1	нижегородский судья санкционировал обыск на мкс по делу открытого космоса
2710	Цены на нефть вынудили Еврокомиссию повысить прогноз по инфляции	0	цены на нефть вынудили еврокомиссию повысить прогноз по инфляции
1083	Кушнер получил Пушкинскую премию, а Войнович и Волос — путинскую	0	кушнер получил пушкинскую премию а войнович и волос  путинскую
4564	ФК «Луч-Энергия» высмеял свое финансовое положение с помощью Mannequin Challenge	0	фк лучэнергия высмеял свое финансовое положение с помощью mannequin challenge
5483	В Чите задержан школьник, назвавший Штирлица вымышленным героем	1	в чите задержан школьник назвавший штирлица вымышленным героем
4988	Расходы на ремонт «Ауруса» из правительственного кортежа заложат в акциз на бензин	1	расходы на ремонт ауруса из правительственного кортежа заложат в акциз на бензин
1884	Зюганов: «В советское время таких, как Навальный, судили за спекуляцию»	1	зюганов в советское время таких как навальный судили за спекуляцию
4883	Китай построит задуманные Сергеем Шойгу города в Сибири за 4 года	1	китай построит задуманные сергеем шойгу города в сибири за  года
389	Школьников оштрафовали за несанкционированную акцию протеста в Minecraft	1	школьников оштрафовали за несанкционированную акцию протеста в minecraft
2494	Госдума назвала возможного сменщика Анатолия Аксакова в Национальном банковском совете	0	госдума назвала возможного сменщика анатолия аксакова в национальном банковском совете
4078	«Не пьют, не курят, свинину не едят»: российским студентам поставили в пример талибов	1	не пьют не курят свинину не едят российским студентам поставили в пример талибов
3036	На сайте госуслуг появится капча для проверки на русофобию	1	на сайте госуслуг появится капча для проверки на русофобию
4046	Береговая охрана утопила лодку с антипрививочниками	1	береговая охрана утопила лодку с антипрививочниками
845	Бывший глава Коммерсанта нашел работу в нефтяной компании	0	бывший глава коммерсанта нашел работу в нефтяной компании
542	Япония начала производство европейских вертолетов	0	япония начала производство европейских вертолетов
91	Андрей Кондрашов снимет фильм «Минск. Дорога домой»	1	андрей кондрашов снимет фильм минск дорога домой
5413	Песня Лазарева для «Евровидения» попала в чарты российского iTunes	0	песня лазарева для евровидения попала в чарты российского itunes
3601	В России запретят ношение карманных фонариков	1	в россии запретят ношение карманных фонариков
1979	Boeing изменит схемы поставок для защиты от природных катастроф	0	boeing изменит схемы поставок для защиты от природных катастроф
3244	«Коммерсантъ» сообщил о продлении контракта Миллера с «Газпромом» на пять лет	0	коммерсантъ сообщил о продлении контракта миллера с газпромом на пять лет
3679	Ярославский шинный завод выиграл тендер на поставку миллиона шин для благоустройства московских дворов	1	ярославский шинный завод выиграл тендер на поставку миллиона шин для благоустройства московских дворов
3150	Россия вышла из договора по нераспространению торсионного оружия	1	россия вышла из договора по нераспространению торсионного оружия
4700	В Газпроме сравнили действия Еврокомиссии с воровством	0	в газпроме сравнили действия еврокомиссии с воровством
3793	Ученые вывели формулу лунного скафандра	0	ученые вывели формулу лунного скафандра
5050	В Афганистане сравнят два новых вида униформы для Армии США	0	в афганистане сравнят два новых вида униформы для армии сша
2964	Ассоциация НПФ собрала больше половины пенсионных накоплений в России	0	ассоциация нпф собрала больше половины пенсионных накоплений в россии
3463	В Нью-Йорке проводили на пенсию ветерана ООН, подготовившего свыше 800 резолюций про обеспокоенность	1	в ньюйорке проводили на пенсию ветерана оон подготовившего свыше  резолюций про обеспокоенность
2529	Fujitsu выпустила ноутбук с флэш-памятью вместо жесткого диска	0	fujitsu выпустила ноутбук с флэшпамятью вместо жесткого диска
3808	Tesla Cybertruck оказался менее безопасным, чем советский микроавтобус Латвия	1	tesla cybertruck оказался менее безопасным чем советский микроавтобус латвия
1676	Рядовой Шойгу, пожаловавшийся на дискриминацию из-за фамилии, назначен министром обороны Тувы	1	рядовой шойгу пожаловавшийся на дискриминацию изза фамилии назначен министром обороны тувы
1048	Глобальное потепление грозит жителям российского Заполярья потерей северных льгот	1	глобальное потепление грозит жителям российского заполярья потерей северных льгот
2949	Мэрил Стрип получит награду Центра Кеннеди	0	мэрил стрип получит награду центра кеннеди
1960	Судебные приставы не захотели отчитаться перед Госдумой за конфликт вокруг Котласского ЦБК	0	судебные приставы не захотели отчитаться перед госдумой за конфликт вокруг котласского цбк
2530	Ангела Меркель подала документы на получение российского гражданства	1	ангела меркель подала документы на получение российского гражданства
4811	Продажи автомобилей в США достигли максимума за шесть лет	0	продажи автомобилей в сша достигли максимума за шесть лет
3632	Антимонопольщики пригляделись к ценам на iPhone X	0	антимонопольщики пригляделись к ценам на iphone x
237	«Ваш Гагарин - безбожник»: РПЦ призвала не идеализировать личность первого космонавта	1	ваш гагарин  безбожник рпц призвала не идеализировать личность первого космонавта
3871	Аэрофлот проиграл тендер на управление Шереметьево	0	аэрофлот проиграл тендер на управление шереметьево
4337	Леди Гага обошла Oasis в Книге рекордов Гиннесса	0	леди гага обошла oasis в книге рекордов гиннесса
1133	На Цифровом Октябре начнется Любля	0	на цифровом октябре начнется любля
2880	Уличённых в коррупции чиновников отправят в Соловецкий монастырь	1	уличённых в коррупции чиновников отправят в соловецкий монастырь
1805	Роспотребнадзор обязал американские фастфуды, работающие в России, добавить в меню блюда русской кухни	1	роспотребнадзор обязал американские фастфуды работающие в россии добавить в меню блюда русской кухни
4757	В рамках подготовки к Олимпиаде белорусский ОМОН снял с дистанции 50 триатлонистов	1	в рамках подготовки к олимпиаде белорусский омон снял с дистанции  триатлонистов
163	«Единая Россия» не может укомплектовать фракцию в Госдуме из-за нежелания кандидатов принимать депутатский мандат	1	единая россия не может укомплектовать фракцию в госдуме изза нежелания кандидатов принимать депутатский мандат
4340	В Европе запретили оборот биткоинов, при майнинге которых использовался уголь	1	в европе запретили оборот биткоинов при майнинге которых использовался уголь
5474	Церемония подъёма флага в школах будет проводиться отдельно для каждой смены	1	церемония подъёма флага в школах будет проводиться отдельно для каждой смены
5419	Советник президента по экономике обвинил экспертов Минфина в некомпетентности	0	советник президента по экономике обвинил экспертов минфина в некомпетентности
4679	Вице-губернатора, случайно выругавшегося на украинском языке во время совещания, отстранили на время проверки	1	вицегубернатора случайно выругавшегося на украинском языке во время совещания отстранили на время проверки
5166	Зюганов и Жириновский объявили об объединении КПРФ и ЛДПР	1	зюганов и жириновский объявили об объединении кпрф и лдпр
4144	Сообщившие о коррупции граждане получат право на досрочную пенсию	1	сообщившие о коррупции граждане получат право на досрочную пенсию
265	Хабаровские коммунальные службы перекрасили всю Великую Китайскую стену из-за граффити с Навальным	1	хабаровские коммунальные службы перекрасили всю великую китайскую стену изза граффити с навальным
2001	В пунктах сдачи ЕГЭ будут играть песни из телесериала «Солдаты»	1	в пунктах сдачи егэ будут играть песни из телесериала солдаты
1811	Накануне Дня ВМФ в Петербурге проходит конференция «Роль гомосексуализма в укреплении флотского товарищества»	1	накануне дня вмф в петербурге проходит конференция роль гомосексуализма в укреплении флотского товарищества
3277	El Periodico: европейцы завидуют туркменам из-за низкой стоимости коммунальных услуг	1	el periodico европейцы завидуют туркменам изза низкой стоимости коммунальных услуг
2978	«Яндекс» создал нейросеть, озвучивающую твиты Ройзмана голосом Пучкова	1	яндекс создал нейросеть озвучивающую твиты ройзмана голосом пучкова
5320	Минэнерго: разблокировка Суэцкого канала неминуемо приведёт к росту цен на бензин и дизельное топливо	1	минэнерго разблокировка суэцкого канала неминуемо приведёт к росту цен на бензин и дизельное топливо
2906	«Спокойной ночи, малыши!» покажут специальный выпуск, посвященный ГКЧП	1	спокойной ночи малыши покажут специальный выпуск посвященный гкчп
4148	Получены фотографии вирусов с рекордным разрешением	0	получены фотографии вирусов с рекордным разрешением
1428	Госдума приняла закон о запрете праздношатания	1	госдума приняла закон о запрете праздношатания
398	Standard & Poors повысило рейтинг российских ценных бумаг	0	standard  poors повысило рейтинг российских ценных бумаг
3655	Россия потребует от Украины репарации за оккупацию Крыма с 1954 по 2014 год	1	россия потребует от украины репарации за оккупацию крыма с  по  год
947	Россию назвали самой привлекательной для инвесторов страной в БРИКС	0	россию назвали самой привлекательной для инвесторов страной в брикс
3078	Правительство будет субсидировать гражданам покупку телевизоров	1	правительство будет субсидировать гражданам покупку телевизоров
3138	Гардеробщик, делавший катышки на одежде чиновников, получил 4 года колонии	1	гардеробщик делавший катышки на одежде чиновников получил  года колонии
5131	Госдума запретила называть самогоном алкогольный напиток, произведённый иностранным аппаратом	1	госдума запретила называть самогоном алкогольный напиток произведённый иностранным аппаратом
5347	Российская «молодежка» проиграла второй матч серии с канадцами	0	российская молодежка проиграла второй матч серии с канадцами
4940	СК изучает сведения о причастности Навального к аварии на Чернобыльской АЭС	1	ск изучает сведения о причастности навального к аварии на чернобыльской аэс
3229	Новый альбом Карлы Бруни попал в тройку лидеров французского хит-парада	0	новый альбом карлы бруни попал в тройку лидеров французского хитпарада
3889	Отказавшихся вакцинироваться от коронавируса мужчин направят на принудительный массаж простаты	1	отказавшихся вакцинироваться от коронавируса мужчин направят на принудительный массаж простаты
1452	Из-за «атаки ботов» штаб Навального ввёл регистрацию на митинг по паспорту	1	изза атаки ботов штаб навального ввёл регистрацию на митинг по паспорту
593	Заместителя мэра Омска задержали за расхищение гуманитарной помощи из Гаити	1	заместителя мэра омска задержали за расхищение гуманитарной помощи из гаити
2725	В течение 2022 года каждого российского чиновника обяжут написать статью об Украине	1	в течение  года каждого российского чиновника обяжут написать статью об украине
41	Ученые отказались от классической гипотезы заселения Америки	0	ученые отказались от классической гипотезы заселения америки
560	Лайза Минелли пройдет курс лечения от алкоголизма	0	лайза минелли пройдет курс лечения от алкоголизма
4635	Росстрахнадзор опубликовал свой черный список страховщиков	0	росстрахнадзор опубликовал свой черный список страховщиков
3831	Футболист Милана сравнил дисквалификацию с тюрьмой	0	футболист милана сравнил дисквалификацию с тюрьмой
3982	«Притворялся кабаном»: солдат-срочник признался, что выступил в качестве живой мишени для депутата Рашкина	1	притворялся кабаном солдатсрочник признался что выступил в качестве живой мишени для депутата рашкина
