	title	is_fake	title_processed
3430	Ксения Собчак назначена куратором Северо-Западного федерального округа	1	ксения собчак назначена куратором северозападного федерального округа
1304	Байден поручил создать рабочую группу по внесению поправок в библию	1	байден поручил создать рабочую группу по внесению поправок в библию
236	«Сталин тоже был осведомителем охранного отделения»: глава Общественной палаты призвала граждан активнее сообщать о нарушениях закона	1	сталин тоже был осведомителем охранного отделения глава общественной палаты призвала граждан активнее сообщать о нарушениях закона
4792	На время новогодних выходных отменят акциз на алкоголь	1	на время новогодних выходных отменят акциз на алкоголь
2599	Третий путь Панамского канала построят за три миллиарда долларов	0	третий путь панамского канала построят за три миллиарда долларов
2573	В России ежегодно отмывается четверть ВВП	0	в россии ежегодно отмывается четверть ввп
3280	Охрана Макрона разогнала резиновыми пулями митинг за освобождение Навального	1	охрана макрона разогнала резиновыми пулями митинг за освобождение навального
3186	Житель Барнаула перечислил 600 тысяч рублей на счёт фейкового аккаунта Дональда Трампа в «Одноклассниках»	1	житель барнаула перечислил  тысяч рублей на счёт фейкового аккаунта дональда трампа в одноклассниках
3953	Сергей Кириенко посетил молебен в память жертв финансового кризиса 1998 года	1	сергей кириенко посетил молебен в память жертв финансового кризиса  года
2768	Официально анонсировано третье дополнение к Skyrim	0	официально анонсировано третье дополнение к skyrim
4223	Собянин подарил Заксобранию Омской области букву «А», отвалившуюся с фасада Госдумы	1	собянин подарил заксобранию омской области букву а отвалившуюся с фасада госдумы
2106	Назначение Франсуа Фийона в совет директоров «Зарубежнефти» задерживается из-за справки о несудимости	1	назначение франсуа фийона в совет директоров зарубежнефти задерживается изза справки о несудимости
2679	Определена эффективная при сахарном диабете диета	0	определена эффективная при сахарном диабете диета
2761	Динамо не удержало победу в матче с Сатурном	0	динамо не удержало победу в матче с сатурном
1387	В Томской области 94-летний ветеран попытался получить от государства квартиру, скрыв пребывание в немецком плену	1	в томской области летний ветеран попытался получить от государства квартиру скрыв пребывание в немецком плену
5404	Руководитель «Хора Турецкого» рассказал о еврейских корнях российской эстрады	0	руководитель хора турецкого рассказал о еврейских корнях российской эстрады
5205	Бездетные женщины больше не смогут получить бесплатное высшее образование	1	бездетные женщины больше не смогут получить бесплатное высшее образование
1279	На Марсе нашли источник воды и инопланетной жизни	0	на марсе нашли источник воды и инопланетной жизни
5639	Чиновники признали законным производство 95-ваттных ламп	0	чиновники признали законным производство ваттных ламп
1555	Обнаружена аномалия в расширении Вселенной	0	обнаружена аномалия в расширении вселенной
5201	Немцы увеличат стабфонд еврозоны до триллиона евро	0	немцы увеличат стабфонд еврозоны до триллиона евро
3190	Из-за ужесточения требований Lada Granta пересертифицируют, как механизм автомобилесодержащий	1	изза ужесточения требований lada granta пересертифицируют как механизм автомобилесодержащий
4566	РАО ЕЭС призвало Мосэнерго отказаться от посредников	0	рао еэс призвало мосэнерго отказаться от посредников
5399	Пресс-служба Путина успокаивает бизнесменов: Офшорам пока ничего не грозит	0	прессслужба путина успокаивает бизнесменов офшорам пока ничего не грозит
3594	Партия пенсионеров предлагет разрешить пенсионерам воровать в супермаркетах	1	партия пенсионеров предлагет разрешить пенсионерам воровать в супермаркетах
1920	Стивен Спилберг получил премию Кеннеди	0	стивен спилберг получил премию кеннеди
513	Показан геймплей Beyond Good & Evil 2	0	показан геймплей beyond good  evil 
4177	Apple договорилась с Sharp о производстве экранов для смартфонов	0	apple договорилась с sharp о производстве экранов для смартфонов
1308	Россиянин задержан в Китае за попытку изнасилования кошки	1	россиянин задержан в китае за попытку изнасилования кошки
914	Российские ученые проведут крупнейшее исследование ГМО	0	российские ученые проведут крупнейшее исследование гмо
3452	За сообщение о социально опасных школьниках можно получить до 100 тысяч рублей	1	за сообщение о социально опасных школьниках можно получить до  тысяч рублей
3695	В Госдуму внесли законопроект о выборочном лишении граждан избирательных прав	1	в госдуму внесли законопроект о выборочном лишении граждан избирательных прав
4242	Грибникам напомнили об ответственности за самовольное протаптывание тропинок	1	грибникам напомнили об ответственности за самовольное протаптывание тропинок
3156	ВТО предсказала замедление темпов роста мировой торговли	0	вто предсказала замедление темпов роста мировой торговли
2198	Посетителей Comic-Con удивили отрывком из Трона	0	посетителей comiccon удивили отрывком из трона
774	Пользователи Twitter потребовали от Меган Маркл удалить сообщение о том, что у неё будет девочка	1	пользователи twitter потребовали от меган маркл удалить сообщение о том что у неё будет девочка
4425	Россия осталась без медалей в девятый день ЧМ по водным видам спорта	0	россия осталась без медалей в девятый день чм по водным видам спорта
943	Шамиль Тарпищев назвал состав на финал Кубка Дэвиса	0	шамиль тарпищев назвал состав на финал кубка дэвиса
822	В Германии найден трон Карла Великого	0	в германии найден трон карла великого
4277	КГБ Белоруссии сообщил о нейтрализации последнего владельца Skoda в стране	1	кгб белоруссии сообщил о нейтрализации последнего владельца skoda в стране
164	Владельца сети «Розовый кролик» не пустили в Австралию	1	владельца сети розовый кролик не пустили в австралию
4547	Минкульт: новые правила для музыкантов по литованию произведений не распространяются на рэперов	1	минкульт новые правила для музыкантов по литованию произведений не распространяются на рэперов
3983	ФНС запустила горячую линию, по которой дети смогут сообщить о неуплате налогов родителями	1	фнс запустила горячую линию по которой дети смогут сообщить о неуплате налогов родителями
2538	В Сухуме появится улица Фазиля Искандера	0	в сухуме появится улица фазиля искандера
5492	Warner вступает в войну с российскими пиратами	0	warner вступает в войну с российскими пиратами
1311	Депутаты от Украины и Литвы вынудили российского представителя в ПАСЕ встретить Новый год в туалете	1	депутаты от украины и литвы вынудили российского представителя в пасе встретить новый год в туалете
5228	Дроны начнут «разговаривать» друг с другом	0	дроны начнут разговаривать друг с другом
4794	Для сдерживания продуктовой инфляции россиян обяжут засеивать приусадебные участки	1	для сдерживания продуктовой инфляции россиян обяжут засеивать приусадебные участки
5342	Шекель и песо стали свободно конвертируемыми	0	шекель и песо стали свободно конвертируемыми
3300	Минфин не внес реформу ЕСН в основной налоговый законопроект	0	минфин не внес реформу есн в основной налоговый законопроект
3310	После первого дня работы ПМЭФ уборщицы вымели из туалетов более килограмма кокаина	1	после первого дня работы пмэф уборщицы вымели из туалетов более килограмма кокаина
327	В Полинезии нашли зубы Поля Гогена	0	в полинезии нашли зубы поля гогена
2490	Франческо Тотти выбыл из строя на два месяца	0	франческо тотти выбыл из строя на два месяца
5394	В параде на День ВМФ впервые примут участие летающие тарелки	1	в параде на день вмф впервые примут участие летающие тарелки
4408	Ибрагимович пропустит четыре матча за оскорбление Франции	0	ибрагимович пропустит четыре матча за оскорбление франции
832	С 1 января будет введена плата за входящие СМС	1	с  января будет введена плата за входящие смс
3079	Геннадий Зюганов предложил Георгию Романову и его жене провести медовый месяц в Екатеринбурге	1	геннадий зюганов предложил георгию романову и его жене провести медовый месяц в екатеринбурге
3462	Известный российский техноблогер госпитализирован с острой рекламной недостаточностью	1	известный российский техноблогер госпитализирован с острой рекламной недостаточностью
5042	В Сколково разработали инновационную лопату для жарки блинов	1	в сколково разработали инновационную лопату для жарки блинов
54	Привившимся от коронавируса россиянам добавят две недели к отпуску	1	привившимся от коронавируса россиянам добавят две недели к отпуску
4064	Цена на нефть опустилась ниже 40 долларов за баррель	0	цена на нефть опустилась ниже  долларов за баррель
3451	Испанские аспиранты определили любимый цвет дальтоников	0	испанские аспиранты определили любимый цвет дальтоников
1901	Столетние цветные фотографии найдены на чердаке	0	столетние цветные фотографии найдены на чердаке
1481	В России запретят целоваться на выпускном	1	в россии запретят целоваться на выпускном
4150	Молочники рассказали о перспективах роста цен на свою продукцию	0	молочники рассказали о перспективах роста цен на свою продукцию
3335	Песня Земфиры «Я помню все твои трещинки» стала официальным гимном российских олимпийцев	1	песня земфиры я помню все твои трещинки стала официальным гимном российских олимпийцев
946	ФСБ задержала свыше 200 россиян, которые вели в соцсетях пропаганду в интересах Китая	1	фсб задержала свыше  россиян которые вели в соцсетях пропаганду в интересах китая
3293	Футболиста отстранили на 17 матчей за удар тренера	0	футболиста отстранили на  матчей за удар тренера
2161	США пытаются восстановить доступ к системе SWIFT после хакерской атаки со стороны России	1	сша пытаются восстановить доступ к системе swift после хакерской атаки со стороны россии
4872	ВВС Индии получили первого лицензионного Ястреба	0	ввс индии получили первого лицензионного ястреба
3057	Из-за сбоя в работе Госуслуг были утеряны данные переписи населения	1	изза сбоя в работе госуслуг были утеряны данные переписи населения
768	Юнона простилась с Землей перед дорогой на Юпитер	0	юнона простилась с землей перед дорогой на юпитер
5412	Компания Asus выпустит интернет-планшет Eee Pad	0	компания asus выпустит интернетпланшет eee pad
3495	Мосгорсуд обязал ФБК возместить ВГТРК бюджетные деньги, выделенные на расследование против Фонда	1	мосгорсуд обязал фбк возместить вгтрк бюджетные деньги выделенные на расследование против фонда
285	Сэм Мендес поставит мюзикл по Чарли и шоколадной фабрике	0	сэм мендес поставит мюзикл по чарли и шоколадной фабрике
5684	«Тоттенхэм» подтвердил продажу полузащитника Бейла «Реалу»	0	тоттенхэм подтвердил продажу полузащитника бейла реалу
4524	Михаил Дегтярёв: «Зачем вам бензин, когда есть автомобили Tesla?»	1	михаил дегтярёв зачем вам бензин когда есть автомобили tesla
5117	Надзирательница Харви Вайнштейна дослужилась до начальницы тюрьмы за 1 месяц	1	надзирательница харви вайнштейна дослужилась до начальницы тюрьмы за  месяц
2332	Аркадий Укупник обвинил Тилля Линдеманна в плагиате	1	аркадий укупник обвинил тилля линдеманна в плагиате
2717	Казаки перессорились из-за мест в Совете Федерации	1	казаки перессорились изза мест в совете федерации
2079	Российский стратегический бомбардировщик приземлился в Польше из-за бракованной штурманской линейки	1	российский стратегический бомбардировщик приземлился в польше изза бракованной штурманской линейки
3389	На Украине выкорчевали последнюю берёзу	1	на украине выкорчевали последнюю берёзу
722	Врачам Республики Алтай выделили время и места, чтобы просить милостыню	1	врачам республики алтай выделили время и места чтобы просить милостыню
951	Москвичи требуют вернуть QR-коды в ресторанах	1	москвичи требуют вернуть qrкоды в ресторанах
5011	Microsoft продала миллион копий игры Ninja Gaiden II	0	microsoft продала миллион копий игры ninja gaiden ii
2262	Жан-Мишель Жарр записал песню со Сноуденом	0	жанмишель жарр записал песню со сноуденом
989	RT случайно опубликовал итоговые результаты думских выборов	1	rt случайно опубликовал итоговые результаты думских выборов
3212	Компания Apple заблокировала iPhone Явлинского	1	компания apple заблокировала iphone явлинского
1759	Sega назвала дату выхода Company of Heroes 2	0	sega назвала дату выхода company of heroes 
5091	Производитель пылесосов построил робота-охотника на снайперов	0	производитель пылесосов построил роботаохотника на снайперов
4422	Алексей Навальный опознал свои трусы на фотографиях крещенского купания Владимира Путина	1	алексей навальный опознал свои трусы на фотографиях крещенского купания владимира путина
1724	Пентагон возобновляет разработку гиперзвукового разведчика	0	пентагон возобновляет разработку гиперзвукового разведчика
341	Лоза раскритиковал Навального за попытку бороться с коррупцией	1	лоза раскритиковал навального за попытку бороться с коррупцией
3701	Фан-база BTS помогла учёным изучить приобретённый синдром Дауна	1	фанбаза bts помогла учёным изучить приобретённый синдром дауна
4243	Лучший шутер для Xbox 360 превратится в трилогию	0	лучший шутер для xbox  превратится в трилогию
688	В Счетной палате предложили установить минимальный размер откатов при госзакупках	1	в счетной палате предложили установить минимальный размер откатов при госзакупках
3432	Чиновникам разрешат обливать водой недовольных россиян	1	чиновникам разрешат обливать водой недовольных россиян
966	Путин и Шойгу посетят инвестиционный парк Поле чудес на Дальнем Востоке	1	путин и шойгу посетят инвестиционный парк поле чудес на дальнем востоке
5438	Правительство сняло запрет на вывоз леса в КНДР	1	правительство сняло запрет на вывоз леса в кндр
2203	Силовики пресекли деятельность мошенника, продававшего поддельную свекольную воду для борща	1	силовики пресекли деятельность мошенника продававшего поддельную свекольную воду для борща
2713	Золотовалютные резервы России выросли на рекордные 62 процента	0	золотовалютные резервы россии выросли на рекордные  процента
5587	Смотрительница Эрмитажа сломала нос участнику реконструкции штурма Зимнего	1	смотрительница эрмитажа сломала нос участнику реконструкции штурма зимнего
5264	Нина Хаген раскритиковала исполнение своей композиции оркестром Бундесвера на проводах Меркель	1	нина хаген раскритиковала исполнение своей композиции оркестром бундесвера на проводах меркель
3572	Крупнейшая строительная компания Великобритании подешевела вдвое за несколько часов	0	крупнейшая строительная компания великобритании подешевела вдвое за несколько часов
1990	В России запретят передавать по наследству больше 5 млн рублей	1	в россии запретят передавать по наследству больше  млн рублей
