	title	is_fake	title_processed
1767	Мэр Краснотурьинска отдаст свою газифицированную дачу пенсионерке, которая дозвонилась на Прямую линию	1	мэр краснотурьинска отдаст свою газифицированную дачу пенсионерке которая дозвонилась на прямую линию
3799	Следующим Джеймсом Бондом может стать Евгений Онегин	0	следующим джеймсом бондом может стать евгений онегин
2299	Китай осудил Турцию за призыв не покупать китайское	0	китай осудил турцию за призыв не покупать китайское
2749	Россия и Белоруссия не договорились о поставках нефти	0	россия и белоруссия не договорились о поставках нефти
2420	Международный исторический суд лишил США победы во Второй мировой войне	1	международный исторический суд лишил сша победы во второй мировой войне
24	Жителей села Париж признали иностранными агентами	1	жителей села париж признали иностранными агентами
1088	Северная верфь заложила новый фрегат для ВМФ России	0	северная верфь заложила новый фрегат для вмф россии
5702	Евгений Кафельников выбыл из борьбы в Australian Open	0	евгений кафельников выбыл из борьбы в australian open
2895	Российская легкоатлетка выиграла олимпийское золото с мировым рекордом	0	российская легкоатлетка выиграла олимпийское золото с мировым рекордом
112	Игорь Моисеев отмечает 100-летний юбилей	0	игорь моисеев отмечает летний юбилей
2549	Польша и Литва введут санкции против Германии за посадку самолёта Ryanair	1	польша и литва введут санкции против германии за посадку самолёта ryanair
56	Белорусское телевидение включило рекламу в момент попадания таракана в трансляцию футбольного матча на Олимпиаде	1	белорусское телевидение включило рекламу в момент попадания таракана в трансляцию футбольного матча на олимпиаде
1309	Создатель мельдония объяснил внесение препарата в список запрещенных	0	создатель мельдония объяснил внесение препарата в список запрещенных
695	Нефтепровод Западная Сибирь-Мурманск построят к 2007 году	0	нефтепровод западная сибирьмурманск построят к  году
4182	«Не повторим ошибок прошлого»: новый канцлер ФРГ приказал всем ефрейторам сбрить усы	1	не повторим ошибок прошлого новый канцлер фрг приказал всем ефрейторам сбрить усы
1227	Органы ЗАГСа будут считать живыми только тех россиян, кто принял участие в переписи населения	1	органы загса будут считать живыми только тех россиян кто принял участие в переписи населения
5266	СМИ сообщили о планах Германии предоставить Украине кредит в 500 миллионов евро	0	сми сообщили о планах германии предоставить украине кредит в  миллионов евро
276	В Уголовном кодексе появится наказание за разглагольствование	1	в уголовном кодексе появится наказание за разглагольствование
2451	Россияне, проживающие в Великобритании, провели акцию в поддержку партии Единая Россия	1	россияне проживающие в великобритании провели акцию в поддержку партии единая россия
1833	Архив Алисы в стране чудес идет с молотка	0	архив алисы в стране чудес идет с молотка
682	Мексика раздаст бедным по 11 долларов	0	мексика раздаст бедным по  долларов
4039	Пенсионеров, получающих деньги из-за рубежа, признают иноагентами и лишат социальных выплат	1	пенсионеров получающих деньги изза рубежа признают иноагентами и лишат социальных выплат
4152	Си Цзиньпин поблагодарил щедрый русский народ, который разрешил увеличить экспорт леса в КНР в 12 раз	1	си цзиньпин поблагодарил щедрый русский народ который разрешил увеличить экспорт леса в кнр в  раз
1137	Импортное пиво вернут в школьные буфеты	1	импортное пиво вернут в школьные буфеты
3196	КПРФ потребовала от Рашкина сменить фамилию	1	кпрф потребовала от рашкина сменить фамилию
5129	Акции Twitter упали на пять процентов	0	акции twitter упали на пять процентов
4377	Два чемпиона мира по боксу устроили уличную драку	0	два чемпиона мира по боксу устроили уличную драку
1346	Bloomberg приравнял активы четырех крупнейших банков США к ВВП страны	0	bloomberg приравнял активы четырех крупнейших банков сша к ввп страны
2350	В Госдуме предложили приравнять учителей английского языка к иностранным агентам	1	в госдуме предложили приравнять учителей английского языка к иностранным агентам
2715	Попогребский вошел в жюри фестиваля Сандэнс	0	попогребский вошел в жюри фестиваля сандэнс
3520	Австралия по ошибке разорвала контракт с французской компанией Naval Group, опасаясь санкций Роскомнадзора	1	австралия по ошибке разорвала контракт с французской компанией naval group опасаясь санкций роскомнадзора
3619	Курс доллара приблизился к 54 рублям	0	курс доллара приблизился к  рублям
3921	Жириновский провел рейд по магазинам, торгующим скоромной пищей	1	жириновский провел рейд по магазинам торгующим скоромной пищей
2997	В Нижнем Новгороде чиновники признали сквер в центре города аварийным и отдали землю застройщикам	1	в нижнем новгороде чиновники признали сквер в центре города аварийным и отдали землю застройщикам
4995	«Ростех» задумал возродить фотоаппарат «Зенит»	0	ростех задумал возродить фотоаппарат зенит
2998	Макгрегор захотел драться с Нурмагомедовым в России	0	макгрегор захотел драться с нурмагомедовым в россии
5115	На МКС нашли опасные организмы	0	на мкс нашли опасные организмы
2534	В российских школах создадут антитеррористические молодёжные отряды	1	в российских школах создадут антитеррористические молодёжные отряды
4786	Мадонна и Гай Ричи решили сделать вторую попытку	0	мадонна и гай ричи решили сделать вторую попытку
4726	В Госдуму внесён законопроект о запрете клеветы в адрес движения «Талибан»*	1	в госдуму внесён законопроект о запрете клеветы в адрес движения талибан
81	В Польше готовятся издать поэму Папы Римского	0	в польше готовятся издать поэму папы римского
1972	Россия отказалась поддержать решение ОПЕК о сокращении добычи нефти	0	россия отказалась поддержать решение опек о сокращении добычи нефти
1714	Российская теннисистка выиграла турнир в Мексике	0	российская теннисистка выиграла турнир в мексике
2570	Российское издательство объявило о выпуске книги о 12 подвигах Петрова и Боширова	1	российское издательство объявило о выпуске книги о  подвигах петрова и боширова
3339	Форвард Эменике вылетел в Москву на переговоры о возвращении в «Спартак»	0	форвард эменике вылетел в москву на переговоры о возвращении в спартак
1946	Участников незаконных митингов призовут на военные сборы	1	участников незаконных митингов призовут на военные сборы
5606	Во втором круге турнира в Риме Сафин сыграет с Давыденко	0	во втором круге турнира в риме сафин сыграет с давыденко
3978	Кудрин заступился за доллары и прошелся по рублю	0	кудрин заступился за доллары и прошелся по рублю
1610	Расследование: аппаратная защита от майнинга превратит вашу RTX3060 в GTX660	1	расследование аппаратная защита от майнинга превратит вашу rtx в gtx
2985	Путин заметил снижение темпов роста безработицы в России	0	путин заметил снижение темпов роста безработицы в россии
2664	Airbus построит крупнейшую в мире спутниковую группировку	0	airbus построит крупнейшую в мире спутниковую группировку
3123	Valve анонсировала новую соревновательную карту Cs_mansion для CS:GO в черноморской локации	1	valve анонсировала новую соревновательную карту cs_mansion для csgo в черноморской локации
5623	Пиво Миллер станет южноафриканским	0	пиво миллер станет южноафриканским
4435	Лавров заявил, что передача Виипури Финляндии не связана с её проигрышем России на ЧЕ-2020	1	лавров заявил что передача виипури финляндии не связана с её проигрышем россии на че
665	Ремейк «Зены — королевы воинов» обойдется без Люси Лоулесс	0	ремейк зены  королевы воинов обойдется без люси лоулесс
2194	В Москве прошла торжественная церемония выписки чехов из славян	1	в москве прошла торжественная церемония выписки чехов из славян
3441	В Сеть выложили первый трейлер к новой экранизации «Кэрри»	0	в сеть выложили первый трейлер к новой экранизации кэрри
4895	Путин подписал указ о праздновании 10-летия взятия Киева в 2031 году	1	путин подписал указ о праздновании летия взятия киева в  году
1017	Итальянские учёные обнаружили останки легионеров, которые в момент гибели Помпеи разгоняли митинг	1	итальянские учёные обнаружили останки легионеров которые в момент гибели помпеи разгоняли митинг
557	В Харькове накрыли подпольный завод по перемаркировке русского борща в украинский	1	в харькове накрыли подпольный завод по перемаркировке русского борща в украинский
5719	MGM экранизирует роман Метро 2033	0	mgm экранизирует роман метро 
3866	Кира Найтли поведала о борьбе с облысением	0	кира найтли поведала о борьбе с облысением
1207	В НАТО предложили отменить бесполетную зону в районе мыса Идокопас	1	в нато предложили отменить бесполетную зону в районе мыса идокопас
5192	Дума сумела оставить себе только Газпром, МПС и РАО ЕЭС	0	дума сумела оставить себе только газпром мпс и рао еэс
2787	Решение Цукерберга придержать акции Facebook помогло им вырасти на 5 процентов	0	решение цукерберга придержать акции facebook помогло им вырасти на  процентов
1510	Усейн Болт назвал Криштиану Роналду размазней	0	усейн болт назвал криштиану роналду размазней
3400	Жителям Воронежа разрешат обустраивать бомбоубежища на приусадебных участках	1	жителям воронежа разрешат обустраивать бомбоубежища на приусадебных участках
5580	Власти ДНР решили национализировать завод «Мечела»	0	власти днр решили национализировать завод мечела
4967	ВМС США получили новый подводный миноискатель	0	вмс сша получили новый подводный миноискатель
266	Давида Микеланджело защитят от грязи с помощью сквозняка	0	давида микеланджело защитят от грязи с помощью сквозняка
3816	К лету МПС расформируют	0	к лету мпс расформируют
5305	Генпрокуратура потребовала заблокировать аккаунт Навального в PUBG	1	генпрокуратура потребовала заблокировать аккаунт навального в pubg
2111	Предпочитаю поношенные: Boombl4 рассказал о любимых скинах оружия в CS:GO	1	предпочитаю поношенные boombl рассказал о любимых скинах оружия в csgo
4797	В сезоне-2018/19 Россию в Лиге чемпионов представят три клуба	0	в сезоне россию в лиге чемпионов представят три клуба
1909	С 21 февраля акции ФБК будут проходить на кухнях активистов	1	с  февраля акции фбк будут проходить на кухнях активистов
2859	Razer представила мышку-трансформер	0	razer представила мышкутрансформер
4693	Фастфуд в Нью-Йорке разорился из-за слишком узкого дверного проёма	1	фастфуд в ньюйорке разорился изза слишком узкого дверного проёма
4025	Аккаунт Трампа заблокировали в Brawl Stars	1	аккаунт трампа заблокировали в brawl stars
3907	Джон Фрусчанте объяснил свой уход из Red Hot Chili Peppers	0	джон фрусчанте объяснил свой уход из red hot chili peppers
3101	Екатеринбургский митрополит из-за конфликта с губернатором освятил штаб Навального	1	екатеринбургский митрополит изза конфликта с губернатором освятил штаб навального
1784	Россия запретит европейские чартеры и закроет небо для Украины	0	россия запретит европейские чартеры и закроет небо для украины
1237	Спортсменов, привитых от коронавируса американскими вакцинами, освободят от прохождения допинг-тестов	1	спортсменов привитых от коронавируса американскими вакцинами освободят от прохождения допингтестов
4789	Лукашенко потребовал разблокировать аккаунт Романа Протасевича в Instagram	1	лукашенко потребовал разблокировать аккаунт романа протасевича в instagram
4702	Власти Сингапура предложили бесплатную стерилизацию всем владельцам Xiaomi	1	власти сингапура предложили бесплатную стерилизацию всем владельцам xiaomi
5678	У посольства РФ в Копенгагене произошла драка из-за места в очереди для оформления российского вида на жительство	1	у посольства рф в копенгагене произошла драка изза места в очереди для оформления российского вида на жительство
2186	Телекоммуникационный гигант Orange вышел на российский рынок	0	телекоммуникационный гигант orange вышел на российский рынок
5482	Из-за американских санкций против «Северного потока-2» Россия начнёт строительство «Северного потока-3»	1	изза американских санкций против северного потока россия начнёт строительство северного потока
908	Чубайс призвал ликвидировать общественный транспорт	1	чубайс призвал ликвидировать общественный транспорт
1303	Разработчик опроверг слухи о выходе Halo 4 на консоли нового поколения	0	разработчик опроверг слухи о выходе halo  на консоли нового поколения
5375	Навальный призвал жителей Краснопресненского района голосовать за сокамерника на муниципальных выборах	1	навальный призвал жителей краснопресненского района голосовать за сокамерника на муниципальных выборах
1627	В Иране новость о возможном снятии санкций отметили ракетным салютом в сторону Израиля	1	в иране новость о возможном снятии санкций отметили ракетным салютом в сторону израиля
1522	Intel анонсировала процессоры Atom для медиафонов	0	intel анонсировала процессоры atom для медиафонов
835	Сбербанк приостановил выдачу валютных кредитов физлицам	0	сбербанк приостановил выдачу валютных кредитов физлицам
358	Джейсон Шрайер: «Действия Far Cry 7 будут проходить в Беларуси»	1	джейсон шрайер действия far cry  будут проходить в беларуси
138	Burger King начнет продавать хот-доги	0	burger king начнет продавать хотдоги
299	Российский защитник забросил победную шайбу в матче НХЛ	0	российский защитник забросил победную шайбу в матче нхл
1556	Техасская резня бензопилой возглавила североамериканский кинопрокат	0	техасская резня бензопилой возглавила североамериканский кинопрокат
1003	Джонни Марр запретил британскому премьеру любить The Smiths	0	джонни марр запретил британскому премьеру любить the smiths
382	Сотникова рассказала о любви Кержакова к фигурному катанию	0	сотникова рассказала о любви кержакова к фигурному катанию
2572	Установлен рекорд стоимости на торгах послевоенным искусством	0	установлен рекорд стоимости на торгах послевоенным искусством
761	Затраты ВР на борьбу с нефтяным пятном выросли до 450 миллионов долларов	0	затраты вр на борьбу с нефтяным пятном выросли до  миллионов долларов
3326	Банк «Уралсиб» увеличил капитал на 15, 2 миллиарда  рублей	0	банк уралсиб увеличил капитал на   миллиарда  рублей
2721	Химики продемонстрировали кандидата в предшественники РНК	0	химики продемонстрировали кандидата в предшественники рнк
4956	Москва готовит чрезвычайные меры по погашению внешнего займа	0	москва готовит чрезвычайные меры по погашению внешнего займа
4651	ЮКОС просит власти не взимать долг по НДС за экспорт нефти	0	юкос просит власти не взимать долг по ндс за экспорт нефти
3821	Правительственный кортеж пополнился автобусами с бюджетниками	1	правительственный кортеж пополнился автобусами с бюджетниками
1402	Американцам, родившимся в 1984-м, придётся изменить год рождения	1	американцам родившимся в м придётся изменить год рождения
2677	Противникам вакцинации начали блокировать сим-карты	1	противникам вакцинации начали блокировать симкарты
