	title	is_fake	title_processed
2330	В Москве задержан сторонник Навального, 3 часа удерживавший клавиши Ctrl+Z на сервере ДЭГ	1	в москве задержан сторонник навального  часа удерживавший клавиши ctrlz на сервере дэг
2117	Продлен срок приема предзаказов на танцующего робота-паука	0	продлен срок приема предзаказов на танцующего роботапаука
3164	Дополнение к Prince of Persia выйдет в феврале	0	дополнение к prince of persia выйдет в феврале
2868	Защитника клуба НХЛ обвинили в браконьерстве	0	защитника клуба нхл обвинили в браконьерстве
2263	В регионах, где проживают малочисленные народы, втрое вырастет акциз на алкоголь	1	в регионах где проживают малочисленные народы втрое вырастет акциз на алкоголь
5186	Совет по правам человека предложил вернуть в Уголовный кодекс статью «Мужеложство»	1	совет по правам человека предложил вернуть в уголовный кодекс статью мужеложство
2801	Барселона поставила ультиматум основному вратарю	0	барселона поставила ультиматум основному вратарю
3875	Киево-Печерская лавра отмечает 950-летие	0	киевопечерская лавра отмечает летие
677	Пугачева показала тапки в ответ на критику ее передачи	0	пугачева показала тапки в ответ на критику ее передачи
3914	Паука Василия отправили на 5 лет в колонию за укус полицейского	1	паука василия отправили на  лет в колонию за укус полицейского
4322	В Канаде вывели берёзу-русофоба	1	в канаде вывели берёзурусофоба
2531	Джейсон Уэбли и Джим Авиньон встретят Новый год в Москве	0	джейсон уэбли и джим авиньон встретят новый год в москве
61	Ученые заглянули в прошлое марсианских океанов	0	ученые заглянули в прошлое марсианских океанов
2344	Дик Адвокат обрушился с критикой на тренера сборной России	0	дик адвокат обрушился с критикой на тренера сборной россии
3856	Стивен Содерберг пригласил в новый фильм порнозвезду	0	стивен содерберг пригласил в новый фильм порнозвезду
1253	Лидеры Зенита продлили контракты с клубом	0	лидеры зенита продлили контракты с клубом
4296	Аркадий Укупник обвинил Юлию Латынину в незаконном использовании своего фото	1	аркадий укупник обвинил юлию латынину в незаконном использовании своего фото
1703	Казахи отложили покупку банка Петрокоммерц	0	казахи отложили покупку банка петрокоммерц
2955	По поручению Путина ель в селе Красноярского края украсили новогодними игрушками	1	по поручению путина ель в селе красноярского края украсили новогодними игрушками
5213	Лавров: МИД не допустит, чтобы высланные из Чехии дипломаты спекулировали привезенными сапогами, хрусталем и мебелью	1	лавров мид не допустит чтобы высланные из чехии дипломаты спекулировали привезенными сапогами хрусталем и мебелью
5283	Департамент транспорта Москвы потратит 200 млрд рублей на ремонт воздушных ям	1	департамент транспорта москвы потратит  млрд рублей на ремонт воздушных ям
2004	Роскачество замочило и сожгло мужские носки от Pierre Cardin и Modis	0	роскачество замочило и сожгло мужские носки от pierre cardin и modis
4214	Билли Боб Торнтон снимет роуд-муви	0	билли боб торнтон снимет роудмуви
2809	В бюджет-2022 заложили полтриллиона рублей на возрождение колхозов	1	в бюджет заложили полтриллиона рублей на возрождение колхозов
3691	WADA запретило уроженцам Кавказа выступать от России на Олимпиаде в Токио	1	wada запретило уроженцам кавказа выступать от россии на олимпиаде в токио
3529	Макарова и Веснина выиграли теннисный турнир в Дубае	0	макарова и веснина выиграли теннисный турнир в дубае
733	В Барнауле произошла массовая драка из-за каминг-аута Деми Ловато	1	в барнауле произошла массовая драка изза камингаута деми ловато
3403	Минобороны РФ заинтересовалось французской экипировкой для пехотинцев будущего	0	минобороны рф заинтересовалось французской экипировкой для пехотинцев будущего
4362	Телеприставка Apple TV поступила в продажу в России	0	телеприставка apple tv поступила в продажу в россии
4884	Мэры Содома и Гоморры отказались поддержать Месяц Гордости	1	мэры содома и гоморры отказались поддержать месяц гордости
2543	Россиянам запретят публично критиковать качество дорог	1	россиянам запретят публично критиковать качество дорог
2886	Пойманная Путиным щука получит материальную компенсацию по решению ЕСПЧ	1	пойманная путиным щука получит материальную компенсацию по решению еспч
527	В 2007 году Руперт Мердок терял тысячу долларов каждые 16 секунд	0	в  году руперт мердок терял тысячу долларов каждые  секунд
2611	ФАС заподозрила таможенников в нарушении антимонопольных законов	0	фас заподозрила таможенников в нарушении антимонопольных законов
2364	Невакцинированным россиянам увеличат ставку НДФЛ	1	невакцинированным россиянам увеличат ставку ндфл
5074	Смена веса мужчинами отразилась на их сперме	0	смена веса мужчинами отразилась на их сперме
4540	Рукописный текст Люси в небесах с алмазами уйдет с молотка	0	рукописный текст люси в небесах с алмазами уйдет с молотка
2905	Печерский районный суд Киева запретил деятельность УЕФА на Украине	1	печерский районный суд киева запретил деятельность уефа на украине
803	Американская летная школа впервые выпустила летчиков-испытателей дронов	0	американская летная школа впервые выпустила летчиковиспытателей дронов
857	Мы так делали в Африке: Байден не исключил силовой операции по освобождению Навального	1	мы так делали в африке байден не исключил силовой операции по освобождению навального
1258	«Они сбивали опасные сосули»: суд оправдал фигурантов дела о стрельбе на свадьбе в Петербурге	1	они сбивали опасные сосули суд оправдал фигурантов дела о стрельбе на свадьбе в петербурге
4222	Time Warner уволит 75 процентов персонала New Line	0	time warner уволит  процентов персонала new line
2535	Microsoft подписала рекламный контракт с Viacom	0	microsoft подписала рекламный контракт с viacom
4487	Светлана Тихановская после обеда в Белом доме помыла посуду	1	светлана тихановская после обеда в белом доме помыла посуду
1295	Илон Маск презентовал не требующий энергии подземный эко-холодильник	1	илон маск презентовал не требующий энергии подземный экохолодильник
219	«Когда нас на автобусах возили к президенту, все «деды» заняли места у окна»: Анатолий Вассерман рассказал о случаях дедовщины в Госдуме	1	когда нас на автобусах возили к президенту все деды заняли места у окна анатолий вассерман рассказал о случаях дедовщины в госдуме
2552	Покупатель футболки сборной Украины останется под подпиской о невыезде	1	покупатель футболки сборной украины останется под подпиской о невыезде
1115	Режиссер фильма о войне в Донбассе совершил самоубийство	0	режиссер фильма о войне в донбассе совершил самоубийство
582	В Госдуме предложили перевести все регионы России на московское время	1	в госдуме предложили перевести все регионы россии на московское время
2913	Новую часть Ratchet & Clank выпустят на Blu-ray	0	новую часть ratchet  clank выпустят на bluray
43	На онлайн-свадьбах в 2020 году в России зафиксировано 518 случаев драк	1	на онлайнсвадьбах в  году в россии зафиксировано  случаев драк
1344	«У нас будет свой Талибан, православный»: Герман Стерлигов отреагировал на захват Афганистана террористами	1	у нас будет свой талибан православный герман стерлигов отреагировал на захват афганистана террористами
2181	Суд отклонил иск Навального к оператору системы «Платон»	0	суд отклонил иск навального к оператору системы платон
1379	Роскомнадзор замедлил PornHub за отказ продвигать российский контент	1	роскомнадзор замедлил pornhub за отказ продвигать российский контент
5038	Оззи боится, что больше не сможет выступать	0	оззи боится что больше не сможет выступать
3926	Из-за сноса Останкинской телебашни движение по улице Академика Королёва закроют на месяц	1	изза сноса останкинской телебашни движение по улице академика королёва закроют на месяц
1071	Первые заводные ноутбуки отправились к заказчикам	0	первые заводные ноутбуки отправились к заказчикам
718	Nintendo анонсировала новую модель портативной консоли DS	0	nintendo анонсировала новую модель портативной консоли ds
4173	Минфин оценил сверхдоходы бюджета России в 2010 году	0	минфин оценил сверхдоходы бюджета россии в  году
5598	Давыденко обыграл Южного в Дохе	0	давыденко обыграл южного в дохе
670	ЕС потребовал от РПЦ отказаться от использования восковых свечей для борьбы с глобальным потеплением	1	ес потребовал от рпц отказаться от использования восковых свечей для борьбы с глобальным потеплением
3592	В Швеции изъяли ребёнка из семьи за просмотр мультфильма «Маша и Медведь»	1	в швеции изъяли ребёнка из семьи за просмотр мультфильма маша и медведь
3848	Латвия признала ветеранов Waffen SS борцами с нацизмом	1	латвия признала ветеранов waffen ss борцами с нацизмом
5521	Владимир Мединский представил монографию «Александр Македонский-Рюрик: основатель государства российского»	1	владимир мединский представил монографию александр македонскийрюрик основатель государства российского
2662	Появилось видео из раздевалки «Ростова» после победы над «Андерлехтом»	0	появилось видео из раздевалки ростова после победы над андерлехтом
897	Звезда НБА выиграл в казино 700 тысяч долларов	0	звезда нба выиграл в казино  тысяч долларов
95	Взрыв батареи мобильника убил китайца	0	взрыв батареи мобильника убил китайца
2022	Заводные ноутбуки получили премию за дизайн	0	заводные ноутбуки получили премию за дизайн
4657	«Трансформеров 4» снимут на новые камеры IMAX	0	трансформеров  снимут на новые камеры imax
842	Медведев призвал ввести ограничения по росту для чиновников и простых россиян	1	медведев призвал ввести ограничения по росту для чиновников и простых россиян
1507	«К 2030 году ни в одном доме в Беларуси не должна звучать русская речь»: Wikileaks обнародовал секретные протоколы белорусской оппозиции	1	к  году ни в одном доме в беларуси не должна звучать русская речь wikileaks обнародовал секретные протоколы белорусской оппозиции
5004	ЮКОСу запретили распоряжаться имуществом	0	юкосу запретили распоряжаться имуществом
4773	В России введут государственную монополию на гороскопы	1	в россии введут государственную монополию на гороскопы
4990	Семнадцатилетняя прыгунья с трамплина умерла в гостинице	0	семнадцатилетняя прыгунья с трамплина умерла в гостинице
1862	Опубликован рейтинг самых богатых людей Украины	0	опубликован рейтинг самых богатых людей украины
1323	Анастасия Мыскина уступила Серене Уильямс в финале теннисного турнира в Лейпциге	0	анастасия мыскина уступила серене уильямс в финале теннисного турнира в лейпциге
4382	Долг китайских компаний измерили в ВВП Ирландии	0	долг китайских компаний измерили в ввп ирландии
322	Пенсионный фонд запросил у правительства 500 млрд рублей из-за падения цены биткоина	1	пенсионный фонд запросил у правительства  млрд рублей изза падения цены биткоина
4172	«У русских был целый ГУЛАГ, а у нас всего лишь полмиллиарда долларов»: инженер NASA сравнил космические программы СССР и США	1	у русских был целый гулаг а у нас всего лишь полмиллиарда долларов инженер nasa сравнил космические программы ссср и сша
2954	«Вдвое дешевле плацкарта»: РЖД начнёт продавать билеты зацеперам	1	вдвое дешевле плацкарта ржд начнёт продавать билеты зацеперам
2903	Габриэль Гарсиа Маркес простил Голливуд ради денег	0	габриэль гарсиа маркес простил голливуд ради денег
334	Дед Мороз проведёт прямую линию на «Первом канале» 30 декабря	1	дед мороз проведёт прямую линию на первом канале  декабря
2845	Французские коммунисты требуют вынести тело Наполеона из Дома инвалидов	1	французские коммунисты требуют вынести тело наполеона из дома инвалидов
332	Живите в лесу: Эрдоган распорядился за неделю выселить из турецких городов всех противников вакцинации	1	живите в лесу эрдоган распорядился за неделю выселить из турецких городов всех противников вакцинации
833	В Киеве прошёл многотысячный митинг против «Северного потока-2» и Крымского моста	1	в киеве прошёл многотысячный митинг против северного потока и крымского моста
3664	Поэтесса Юнна Мориц представила набор слов для Послания Президента Федеральному Собранию	1	поэтесса юнна мориц представила набор слов для послания президента федеральному собранию
3765	РТС и ММВБ обновили максимумы 2010 года	0	ртс и ммвб обновили максимумы  года
2422	СК возбудил дело после исчезновения полуострова на Земле Франц-Иосифа	1	ск возбудил дело после исчезновения полуострова на земле франциосифа
3795	Алексей Миллер и Валентина Матвиенко подарят Зениту новый стадион	0	алексей миллер и валентина матвиенко подарят зениту новый стадион
1937	Чиновникам разрешат сбивать пешеходов при «чрезвычайных обстоятельствах»	1	чиновникам разрешат сбивать пешеходов при чрезвычайных обстоятельствах
731	Японцы посчитали число Пи с рекордной точностью	0	японцы посчитали число пи с рекордной точностью
291	Несанкционированный митинг в поддержку арестованного губернатора Белозерцева проходит в Пензе	1	несанкционированный митинг в поддержку арестованного губернатора белозерцева проходит в пензе
184	Автор песни American Pie арестован за домашнее насилие	0	автор песни american pie арестован за домашнее насилие
1820	Хусейн Амини доработает сценарий Белоснежки и егеря	0	хусейн амини доработает сценарий белоснежки и егеря
2053	Вимм-Билль-Данн купил Пастушка и 33 коровы	0	виммбилльданн купил пастушка и  коровы
3615	Французские табачники забастовали от возмущения	0	французские табачники забастовали от возмущения
533	Европарламентарии посоветовали Дональду Туску сменить имя	1	европарламентарии посоветовали дональду туску сменить имя
3038	Сериал «Призрак Оперы» снимет режиссер «Амели»	0	сериал призрак оперы снимет режиссер амели
2698	В геленджикском дворце ищут заблудившихся офицеров с «ядерным чемоданчиком»	1	в геленджикском дворце ищут заблудившихся офицеров с ядерным чемоданчиком
3563	На разработчика процессоров MIPS нашелся покупатель	0	на разработчика процессоров mips нашелся покупатель
4861	Лукашенко пригрозил отхлестать ремнём президента НОК Белоруссии, если страна не привезёт медали из Токио	1	лукашенко пригрозил отхлестать ремнём президента нок белоруссии если страна не привезёт медали из токио
657	Белорусский ОМОН принял на вооружение новейшие ЗРК Бук-М2	1	белорусский омон принял на вооружение новейшие зрк букм
2306	Арнольд Шварценеггер готов стать Терминатором в четвертый раз	0	арнольд шварценеггер готов стать терминатором в четвертый раз
2303	Швеция вышла на первое место в мире по использованию IT	0	швеция вышла на первое место в мире по использованию it
2287	НАСА показало высококачественный снимок высадки миссии Apollo 12 на Луну	0	наса показало высококачественный снимок высадки миссии apollo  на луну
